check_id,phase,required_before_claim,current_status,evidence,next_action
local_validation_before_sweep,pre_run,true,ready,run_integrity rows: 69; run_results rows: 69; failing rows: 0; report exists: True.,"Run lake build, validate_all, public export validation, and run_integrity immediately before provider sweeps."
provider_runner_contract,pre_run,true,ready,provider readiness rows: 12; required checks covered: 12/12; failures: 0; cautions: 1; blocks: 1; report exists: True.,Set the relevant runner env var and provider API key in the shell only; run a one-task smoke command first.
scaffold_ladder_contract,pre_run,true,ready,scaffold audit rows: 11; required checks covered: 11/11; failures: 0; cautions: 1; report exists: True.,"Keep one-shot, lookup, and lookup_unlimited prompt semantics fixed across provider runs."
planned_primary_cells,run,true,planned,"accepted_tasks=6; planned_rows=18; scaffolds=[""lookup"", ""lookup_unlimited"", ""one-shot""]; planned_k=[""10""]; command_rows=12",Run exactly the accepted_v0 x scaffold commands for each provider/model being reported.
transcript_and_run_result_evidence,post_run,true,blocked,"Non-infra model rows: 2; scaffolds observed: [""one-shot""]; planned rows: 18.","Commit run_results rows and transcript JSONL files, regenerate the transcript queue, complete failure-label review rows, then rerun integrity and model-result analysis."
frontier_claim_boundary,post_run,true,blocked,Non-infra model rows: 2 over 6 accepted tasks; total model rows including infra failures: 3.,Keep frontier and scaffold-effect claims unsupported until non-infra accepted-core coverage is broad enough.
statistical_report_refresh,post_run,true,blocked,"rows=9; statuses={""block"": 5, ""pass"": 4}",Rerun statistical reporting after provider rows are committed; report raw n and Wilson intervals.
