gate_id,decision_scope,decision,status,evidence_basis,blocking_or_caution_items,required_next_action
local_release_artifact,artifact_release,"OK to treat v0.1 as a locally validated research artifact, not as a locked benchmark.",pass,"release-artifact gaps=0; integrity failures=0; requirement statuses={""not_met"": 2, ""partial"": 4, ""supported"": 27}; `public_export_no_hidden_leak`=supported: Public export exists: True; exported tasks: 14; hidden/wrong paths: 0.; `run_integrity_audit`=supported: run_integrity rows: 69; run_results rows: 69; failing rows: 0; report exists: True.",Scope is local validation only; hosted QA and independent timing are outside this decision.,Keep artifact claims scoped to local reproducibility and local grading evidence.
research_report_readiness,reporting,OK to use the report as a research review memo if caveats and unsupported claims stay visible.,pass,"research-report gaps=0; claim statuses={""partial"": 2, ""supported"": 4, ""unsupported"": 3}; unsupported claims=[""scaffold_effects"", ""frontier_performance"", ""locked_benchmark""]",The report is evidence-rich but not backed by broad model sweeps or independent timing.,"Update the decision log whenever a requirement, claim audit, or provider sweep changes."
accepted_core_stats_scope,task_set,Use accepted_v0 rows for artifact-level task-quality summaries only; do not use them for population-level frontier claims.,caution,accepted-core rows=6; caveat rows=3; automation-dominated rows=2; `portfolio_accepted_count`=not_met: 6 accepted_v0 tasks; 8 calibration-only tasks; 12 rejected archive tasks.; `task_quality_matrix`=supported: task_quality_matrix rows: 26; metadata rows: 26; report exists: True.,The core is intentionally small and several rows retain caveats.,Add independently reviewed T2/T3/T4 rows before treating accepted-core aggregates as benchmark estimates.
hidden_pin_confidence,grading,Treat hidden pins as meaningful anti-gaming probes but not exhaustive semantic equivalence checks.,caution,accepted tasks with wrong submissions reaching hidden pins=4/6; `pin_coverage_audit`=supported: pin_coverage rows: 26; accepted rows: 6; accepted hidden-pin wrong failures: 5; report exists: True.; claim=partial,Some fixed-statement rows fail wrong submissions before hidden pins run; finite pins cannot cover every weakening.,Add same-signature hidden-pin failures where realistic and expand negative examples for retained caveat rows.
time_horizon_claim,construct_validity,Do not claim strong time-horizon measurement yet.,block,"`time_horizon_spread`=partial: Accepted bucket counts: {""T2"": 5, ""T3"": 1}; release bucket counts: {""T1"": 8, ""T2"": 5, ""T3"": 1}.; claim=partial",Accepted core has no T4 task and only one T3 task; human times are not independently measured.,"Add independently timed T3/T4 tasks, including at least one T4 row, before claiming robust time-horizon coverage."
scaffold_effect_claim,performance,Do not report scaffold-effect conclusions from committed data.,block,"`scaffold_result_comparison`=partial: Non-infra model rows: 2; scaffolds observed: [""one-shot""]; planned rows: 18.; primary plan coverage={""analysis_set"": ""primary_plan_coverage"", ""covered_cells_any"": ""1"", ""covered_cells_noninfra"": ""1"", ""group"": ""all"", ""group_by"": ""all"", ""infra_fail_rows"": ""1"", ""mean_pass_at_k"": ""0.0000"", ""notes"": ""Coverage of the planned accepted_v0 x scaffold sweep by committed provider rows."", ""planned_cells"": ""18"", ""rows_noninfra"": ""1"", ""rows_total"": ""2"", ""successes"": ""0"", ""timeout_rows"": ""0"", ""wilson_high"": ""0.7935"", ""wilson_low"": ""0.0000""}; claim=unsupported","The scaffold ladder exists, but accepted-core provider data cover only one non-infra one-shot cell.",Run the planned accepted_v0 x scaffold sweep with fixed k before comparing scaffold effects.
frontier_performance_claim,performance,Do not use committed provider rows to characterize frontier-model capability.,block,`frontier_model_evidence`=partial: Non-infra model rows: 2 over 6 accepted tasks; total model rows including infra failures: 3.; claim=unsupported,Provider rows are smoke evidence only and include an infra failure.,Run documented provider sweeps after local and hosted QA are stable.
locked_benchmark_freeze,benchmark_status,Do not call v0.1 a locked benchmark.,block,"locked-benchmark gaps=6: [""portfolio_accepted_count"", ""time_horizon_spread"", ""scaffold_result_comparison"", ""frontier_model_evidence"", ""independent_human_time_review"", ""hosted_qa_env_linter""]; claim=unsupported","The accepted count, time-horizon spread, scaffold data, frontier data, independent timing, and hosted QA are not complete.","Reach the 20-50 accepted-task target, complete hosted QA, independent timing, and scaffold sweeps, then freeze exact task versions."
